{
  "protocolVersion": 2,
  "action": "text",
  "text": "字字字字字字字字字字字字字字字字字字字字字字字字字字字字字字字字字字字字字字字字字字字字字字字字字字字字字字字字字字字字字字字字字字字字字字字字字字字字字字字字字字字字字字字字字字字字字字字字字字字字字字字字字字字字字字字字字字字字字字字字字字字字字字字字字字字字字字字字字字字字字字字字字字字字字字字字字字字字字字字字字字字字字字字字字字字字字字字字字字字字字字字字字字字字字字字字字字字字字字字字字字字字字字字字字字字字字字字字字字字字字字字字字字字字字字字字字字字字字字字字字字字字字字字字字字字字字字字字字字字字字字字字字字字字字字字字字字字字字字字字字字字字字字字字字字字字字字字字字字字字字字字字字字字字字字字字字字字字字字字字字字字字字字字字字字字字字字字字字字字字字字字字字字字字字字字字字字字字字字字字字字字字字字字字字字字字字字字字字字字字字字字字字字字字字字字字字字字字字字字字字字字字字字字字字字字字字字字字字字字字字字字字字字字字字字字字字字字字字字字字字字字字字字字字字字字字字字字字字字字字字字字字字字字字字字字字字字字字字字字字字字字字字字字字字字字字字字字字字字字字字字字字字字字字字字字字字字字字字字字字字字字字字字字字字字字字字字字字字字字字字字字字字字字字字字字字字字字字字字字字字字字字字字字字字字字字字字字字字字字字字字字字字字字字字字字字字字字字字字字字字字字字字字字字字字字字字字字字字字字字字字字字字字字字字字字字字字字字字字字字字字字字字字字字字字字字字字字字字字字字字字字字字字字字字字字字字字字字字字字字字字字字字字字字字字字字字字字字字字字字字字字字字字字字字字字字字字字字字字字字字字字字字字字字字字字字字字字字字字字字字字字字字字字字字字字字字字字字字字字字字字字字字字字字字字字字字字字字字字字字字字字字字字字字字字字字字字字字字字字字字字字字字字字字字字字字字字字字字字字字字字字字字字字字字字字字字字字字字字字字字字字字字字字字字字字字字字字字字字字字字字字字字字字字字字字字字字字字字字字字字字字字字字字字字字字字字字字字字字字字字字字字字字字字字字字字字字字字字字字字字字字字字字字字字字字字字字字字字字字字字字字字字字字字字字字字字字字字字字字字字字字字字字字字字字字字字字字字字字字字字字字字字字字字字字字字字字字字字字字字字字字字字字字字字字字字字字字字字字字字字字字字字字字字字字字字字字字字字字字字字字字字字字字字字字字字字字字字字字字字字字字字字字字字字字字字字字字字字字字字字字字字字字字字字字字字字字字字字字字字字字字字字字字字字字字字字字字字字字字字字字字字字字字字字字字字字字字字字字字字字字字字字字字字字字字字字字字字字字字字字字字字字字字字字字字字字字字字字字字字字字字字字字字字字字字字字字字字字字字字字字字字字字字字字字字字字字字字字字字字字字字字字字字字字字字字字字字字字字字字字字字字字字字字字字字字字字字字字字字字字字字字字字字字字字字字字字字字字字字字字字字字字字字字字字字字字字字字字字字字字字字字字字字字字字字字字字字字字字字字字字字字字字字字字字字字字字字字字字字字字字字字字字字字字字字字字字字字字字字字字字字字字字字字字字字字字字字字字字字字字字字字字字字字字字字字字字字字字字字字字字字字字字字字字字字字字字字字字字字字字字字字字字字字字字字字字字字字字字字字字字字字字字字字字字字字字字字字字字字字字字字字字字字字字字字字字字字字字字字字字字字字字字字字字字字字字字字字字字字字字字字字字字字字字字字字字字字字字字字字字字字字字字字字字字字字字字字字字字字字字字字字字字字字字字字字字字字字字字字字字字字字字字字字字字字字字字字字字字字字字字字字字字字字字字字字字字字字字字字字字字字字字字字字字字字字字字字字字字字字字字字字字字字字字字字字字字字字字字字字字字字字字字字字字字字字字字字字字字字字字字字字字字字字字字字字字字字字字字字字字字字字字字字字字字字字字字字字字字字字字字字字字字字字字字字字字字字字字字字字字字字字字字字字字字字字字字字字字字字字字字字字字字字字字字字字字字字字字字字字字字字字字字字字字字字字字字字字字字字字字字字字字字字字字字字字字字字字字字字字字字字字字字字字字字字字字字字字字字字字字字字字字字字字字字字字字字字字字字字字字字字字字字字字字字字字字字字字字字字字字字字字字字字字字字字字字字字字字字字字字字字字字字字字字字字字字字字字字字字字字字字字字字字字字字字字字字字字字字字字字字字字字字字字字字字字字字字字字字字字字字字字字字字字字字字字字字字字字字字字字字字字字字字字字字字字字字字字字字字字字字字字字字字字字字字字字字字字字字字字字字字字字字字字字字字字字字字字字字字字字字字字字字字字字字字字字字字字字字字字字字字字字字字字字字字字字字字字字字字字字字字字字字字字字字字字字字字字字字字字字字字字字字字字字字字字字字字字字字字字字字字字字字字字字字字字字字字字字字字字字字字字字字字字字字字字字字字字字字字字字字字字字字字字字字字字字字字字字字字字字字字字字字字字字字字字字字字字字字字字字字字字字字字字字字字字字字字字字字字字字字字字字字字字字字字字字字字字字字字字字字字字字字字字字字字字字字字字字字字字字字字字字字字字字字字字字字字字字字字字字字字字字字字字字字字字字字字字字字字字字字字字字字字字字字字字字字字字字字字字字字字字字字字字字字字字字字字字字字字字字字字字字字字字字字字字字字字字字字字字字字字字字字字字字字字字字字字字字字字字字字字字字字字字字字字字字字字字字字字字字字字字字字字字字字字字字字字字字字字字字字字字字字字字字字字字字字字字字字字字字字字字字字字字字字字字字字字字字字字字字字字字字字字字字字字字字字字字字字字字字字字字字字字字字字字字字字字字字字字字字字字字字字字字字字字字字字字字字字字字字字字字字字字字字字字字字字字字字字字字字字字字字字字字字字字字字字字字字字字字字字字字字字字字字字字字字字字字字字字字字字字字字字字字字字字字字字字字字字字字字字字字字字字字字字字字字字字字字字字字字字字字字字字字字字字字字字字字字字字字字字字字字字字字字字字字字字字字字字字字字字字字字字字字字字字字字字字字字字字字字字字字字字字字字字字字字字字字字字字字字字字字字字字字字字字字字字字字字字字字字字字字字字字字字字字字字字字字字字字字字字字字字字字字字字字字字字字字字字字字字字字字字字字字字字字字字字字字字字字字字字字字字字字字字字字字字字字字字字字字字字字字字字字字字字字字字字字字字字字字字字字字字字字字字字字字字字字字字字字字字字字字字字字字字字字字字字字字字字字字字字字字字字字字字字字字字字字字字字字字字字字字字字字字字字字字字字字字字字字字字字字字字字字字字字字字字字字字字字字字字字字字字字字字字字字字字字字字字字字字字字字字字字字字字字字字字字字字字字字字字字字字字字字字字字字字字字字字字字字字字字字字字字字字字字字字字字字字字字字字字字字字字字字字字字字字字字字字字字字字字字字字字字字字字字字字字字字字字字字字字字字字字字字字字字字字字字字字字字字字字字字字字字字字字字字字字字字字字字字字字字字字字字字字字字字字字字字字字字字字字字字字字字字字字字字字字字字字字字字字字字字字字字字字字字字字字字字字字字字字字字字字字字字字字字字字字字字字字字字字字字字字字字字字字字字字字字字字字字字字字字字字字字字字字字字字字字字字字字字字字字字字字字字字字字字字字字字字字字字字字字字字字字字字字字字字字字字字字字字字字字字字字字字字字字字字字字字字字字字字字字字字字字字字字字字字字字字字字字字字字字字字字字字字字字字字字字字字字字字字字字字字字字字字字字字字字字字字字字字字字字字字字字字字字字字字字字字字字字字字字字字字字字字字字字字字字字字字字字字字字字字字字字字字字字字字字字字字字字字字字字字字字字字字字字字字字字字字字字字字字字字字字字字字字字字字字字字字字字字字字字字字字字字字字字字字字字字字字字字字字字字字字字字字字字字字字字字字字字字字字字字字字字字字字字字字字字字字字字字字字字字字字字字字字字字字字字字字字字字字字字字字字字字字字字字字字字字字字字字字字字字字字字字字字字字字字字字字字字字字字字字字字字字字字字字字字字字字字字字字字字字字字字字字字字字字字字字字字字字字字字字字字字字字字字字字字字字字字字字字字字字字字字字字字字字字字字字字字字字字字字字字字字字字字字字字字字字字字字字字字字字字字字字字字字字字字字字字字字字字字字字字字字字字字字字字字字字字字字字字字字字字字字字字字字字字字字字字字字字字字字字字字字字字字字字字字字字字字字字字字字字字字字字字字字字字字字字字字字字字字字字字字字字字字字字字字字字字字字字字字字字字字字字字字字字字字字字字字字字字字字字字字字字字字字字字字字字字字字字字字字字字字字字字字字字字字字字字字字字字字字字字字字字字字字字字字字字字字字字字字字字字字字字字字字字字字字字字字字字字字字字字字字字字字字字字字字字字字字字字字字字字字字字字字字字字字字字字字字字字字字字字字字字字字字字字字字字字字字字字字字字字字字字字字字字字字字字字字字字字字字字字字字字字字字字字字字字字字字字字字字字字字字字字字字字字字字字字字字字字字字字字字字字字字字字字字字字字字字字字字字字字字字字字字字字字字字字字字字字字字字字字字字字字字字字字字字字字字字字字字字字字字字字字字字字字字字字字字字字字字字字字字字字字字字字字字字字字字字字字字字字字字字字字字字字字字字字字字字字字字字字字字字字字字字字字字字字字",
  "requestId": "req-placeholder-0007",
  "sessionId": "11111111-1111-4111-8111-111111111117",
  "targetComputerId": "computer-placeholder-01"
}
