{
  "protocolVersion": 2,
  "action": "macro",
  "requestId": "req-placeholder-0004",
  "sessionId": "11111111-1111-4111-8111-111111111114",
  "targetComputerId": "computer-placeholder-01",
  "steps": [
    { "type": "keychord", "keys": ["CTRL", "C"], "holdMs": 45, "delayBeforeMs": 0 },
    { "type": "text", "text": "PLACEHOLDER 宏文本内容", "submit": true, "delayBeforeMs": 2000 }
  ]
}
